{
  "$schema": "./corner-config.schema.v1.json",
  "meta": {
    "skill_name": "anchor-spanish",
    "version": "1.5.0",
    "display_name": "西班牙语角主持助手",
    "display_name_en": "Spanish Corner Host",
    "config_owner": "skills/anchor-spanish/SKILL.md",
    "source_of_truth": "skills/anchor-spanish/assets/es-corner-config.json",
    "brief_filename": "es-corner-brief.md",
    "note": "本 JSON 为唯一数据源（落在技能包 assets/ 内）；原框架与方法现已并入 `SKILL.md` 的「附录 A · 生成框架与方法」。"
  },
  "constraints": {
    "max_participants": 10,
    "duration_minutes": 90,
    "max_grammar_primary": 2,
    "max_topics": 2,
    "level_range": [
      "B1",
      "B2",
      "C1",
      "C2"
    ],
    "level_mixed_label": "混合（B1–C2）",
    "ask_options_per_question": 6,
    "questions_max_per_call": 4,
    "hint_words_range": [
      3,
      5
    ]
  },
  "grammar_points": {
    "adj_adv": {
      "id": "adj_adv",
      "label": "形容词与副词",
      "children": [
        {
          "id": "adj_agreement",
          "label": "性数一致与位置（后置定语；前置义变 un gran hombre / un hombre grande）"
        },
        {
          "id": "adj_short_forms",
          "label": "短尾形式（buen / mal / primer / tercer / algún / ningún / cien）"
        },
        {
          "id": "adj_comparative",
          "label": "比较级（más / menos…que、tan…como；不规则 mejor / peor / mayor / menor）"
        },
        {
          "id": "adj_superlative",
          "label": "最高级（el / la más…de；绝对最高级 -ísimo）"
        },
        {
          "id": "adj_diminutives",
          "label": "指小与指大词（-ito / -illo；-ón / -ote / -azo）"
        },
        {
          "id": "adv_degree",
          "label": "副词与程度修饰（muy / mucho / tan / tanto；-mente；ya / todavía）"
        }
      ]
    },
    "indicativo": {
      "id": "indicativo",
      "label": "直陈式动词系统",
      "children": [
        {
          "id": "ind_presente",
          "label": "现在时（e→ie / o→ue / e→i 词干变化；不规则第一人称）"
        },
        {
          "id": "ind_perfecto",
          "label": "现在完成时（he + participio；ya / todavía no / alguna vez）"
        },
        {
          "id": "ind_indefinido",
          "label": "简单过去时（重音规则；-uv- / -i- / -j- 不规则组）"
        },
        {
          "id": "ind_imperfecto",
          "label": "未完成过去时（描写与习惯；与 indefinido 的叙事分工）"
        },
        {
          "id": "ind_pluscuamperfecto",
          "label": "过去完成时（había + participio；叙事中的「更早」）"
        },
        {
          "id": "ind_futuro",
          "label": "将来时（futuro simple 不规则词干；ir a + infinitivo）"
        }
      ]
    },
    "pronombres": {
      "id": "pronombres",
      "label": "代词系统",
      "children": [
        {
          "id": "pro_sujeto",
          "label": "主语代词与省略（零主语；vosotros / ustedes；voseo）"
        },
        {
          "id": "pro_od",
          "label": "直接宾语代词（lo / la / los / las；leísmo / laísmo / loísmo）"
        },
        {
          "id": "pro_oi",
          "label": "间接宾语与冗余 le（le / les 与 a + 名词必须共现）"
        },
        {
          "id": "pro_double_order",
          "label": "双代词顺序（le / les → se + lo / la；代词与动词的位次）"
        },
        {
          "id": "pro_se",
          "label": "se 的多重用法（自复 / 相互 / 无人称 / 被动 / 意外）"
        },
        {
          "id": "pro_posesivos",
          "label": "物主与夺格（su 歧义；mío / tuyo；conmigo / contigo / consigo）"
        }
      ]
    },
    "relativas_conj": {
      "id": "relativas_conj",
      "label": "关系从句与连词",
      "children": [
        {
          "id": "rel_pronouns",
          "label": "关系代词（que / quien / el que / el cual）"
        },
        {
          "id": "rel_cuyo",
          "label": "所有格关系词（cuyo / cuya / cuyos / cuyas）"
        },
        {
          "id": "rel_adverb",
          "label": "关系副词（donde / cuando / como；el que + 介词 对应法语 dont）"
        },
        {
          "id": "conj_coord",
          "label": "并列连词（y → e / o → u；pero vs sino；ni…ni）"
        },
        {
          "id": "conj_subord",
          "label": "从属连词（porque / ya que / así que / cuando / en cuanto）"
        },
        {
          "id": "conj_concesiva",
          "label": "让步与条件（aunque + 直陈 / 虚拟；a pesar de；si / a menos que / siempre que）"
        }
      ]
    },
    "modos": {
      "id": "modos",
      "label": "语式系统（虚拟式 · 条件式 · 命令式）",
      "children": [
        {
          "id": "mode_condicional",
          "label": "条件式（礼貌请求 / 假设 / 传闻；不规则词干同 futuro）"
        },
        {
          "id": "mode_si",
          "label": "Si 三搭配（现在 + 将来 / 过去未完成 + 条件式 / 过去完成 + 条件式完成）"
        },
        {
          "id": "mode_subj_presente",
          "label": "虚拟式现在时（-ar → -e 系 / -er·-ir → -a 系；dar / estar / haber / ir / saber / ser）"
        },
        {
          "id": "mode_subj_pasado",
          "label": "虚拟式过去时与时态配合（-ra / -se 等价；主句过去 → 从句过去虚拟）"
        },
        {
          "id": "mode_subj_triggers",
          "label": "虚拟式触发 7 类 + 直陈 / 虚拟边界（愿望 / 必要 / 情感 / 怀疑 / 目的 / 让步 / 时间将来；aunque / ojalá / quizás）"
        },
        {
          "id": "mode_imperativo",
          "label": "命令式（肯定式不规则 tú / vosotros；否定式借虚拟式；代词后置）"
        }
      ]
    },
    "no_finitas_pasiva": {
      "id": "no_finitas_pasiva",
      "label": "非谓语与被动态",
      "children": [
        {
          "id": "nf_infinitivo",
          "label": "不定式结构（ir a / tener que / hay que / acabar de / volver a / al + 不定式）"
        },
        {
          "id": "nf_gerundio",
          "label": "gerundio（estar + gerundio 进行；seguir / llevar / quedarse + gerundio）"
        },
        {
          "id": "nf_participio",
          "label": "过去分词（规则 -ado / -ido；不规则 hecho / dicho / visto；与 haber / ser / estar 配合）"
        },
        {
          "id": "pasiva_ser_estar",
          "label": "被动与状态（ser + 分词全时态 + por；estar + 分词的结果义）"
        },
        {
          "id": "pasiva_se",
          "label": "se 被动与无人称（se vende / se habla / se dice que；第三人称复数无人称）"
        }
      ]
    },
    "fragmentos": {
      "id": "fragmentos",
      "label": "常用碎片语法点（可单独勾选：跨章节组合 + 零散辨析）",
      "children": [
        {
          "id": "frag_pasados",
          "label": "过去时组（indefinido · imperfecto · pluscuamperfecto）"
        },
        {
          "id": "frag_modos",
          "label": "语式组（虚拟式 · 命令式 · 条件式）"
        },
        {
          "id": "frag_objeto",
          "label": "宾格组（lo / le / se lo · 人称 a）"
        },
        {
          "id": "frag_ser_estar",
          "label": "ser vs estar（性质 / 状态 / 位置；形容词义变）"
        },
        {
          "id": "frag_por_para",
          "label": "por vs para（原因 / 目的 / 交换 / 期限）"
        },
        {
          "id": "frag_interrog",
          "label": "疑问词与疑问句（qué / cuál / cómo / dónde；语序与倒问号）"
        },
        {
          "id": "frag_num",
          "label": "数字与量词（cien / ciento；muy vs mucho；比例与数量）"
        }
      ]
    }
  },
  "participant_levels": [
    {
      "id": "B1",
      "label": "B1"
    },
    {
      "id": "B2",
      "label": "B2"
    },
    {
      "id": "C1",
      "label": "C1"
    },
    {
      "id": "C2",
      "label": "C2"
    },
    {
      "id": "mixed",
      "label": "混合（B1–C2）"
    }
  ],
  "scales": [
    {
      "id": "s_2_4",
      "label": "2–4 人 / 90 分钟",
      "people_min": 2,
      "people_max": 4,
      "minutes": 90,
      "note": "小班，全员互动"
    },
    {
      "id": "s_5_8",
      "label": "5–8 人 / 90 分钟",
      "people_min": 5,
      "people_max": 8,
      "minutes": 90,
      "note": "中班，圆桌交流"
    },
    {
      "id": "s_9_10",
      "label": "9–10 人 / 90 分钟",
      "people_min": 9,
      "people_max": 10,
      "minutes": 90,
      "note": "大班，轮流发言"
    }
  ],
  "topic_dimensions": [
    {
      "id": "personal",
      "label": "个人经历 / 日常",
      "desc": "past / present 类语法：上周、童年、一次难忘的事、日常习惯"
    },
    {
      "id": "desire",
      "label": "愿望 / 假设",
      "desc": "条件式 / 虚拟式：如果……、理想、给他人建议"
    },
    {
      "id": "social",
      "label": "社会 / 比较 / 观点",
      "desc": "抽象、辩论：对比、责任、社会现象、文化"
    }
  ],
  "topic_pool": [
    {
      "id": "viajes",
      "label": "Los viajes",
      "desc": "假期、理想目的地、旅途中的意外"
    },
    {
      "id": "gastronomia",
      "label": "La gastronomía",
      "desc": "家乡菜、餐厅体验、饮食习惯"
    },
    {
      "id": "cine",
      "label": "El cine",
      "desc": "最近看的作品、偏好类型、观影习惯"
    },
    {
      "id": "musica",
      "label": "La música",
      "desc": "音乐口味、现场演出、音乐与生活"
    },
    {
      "id": "deporte",
      "label": "El deporte",
      "desc": "日常锻炼、观看比赛、体育精神"
    },
    {
      "id": "medio_ambiente",
      "label": "El medio ambiente",
      "desc": "垃圾分类、低碳生活、气候行动"
    },
    {
      "id": "trabajo",
      "label": "El trabajo",
      "desc": "职业选择、远程办公、职场文化"
    },
    {
      "id": "familia",
      "label": "La familia",
      "desc": "亲情、友谊、代际差异"
    },
    {
      "id": "fiestas",
      "label": "Las fiestas",
      "desc": "节庆记忆、习俗对比、送礼"
    },
    {
      "id": "tecnologia",
      "label": "La tecnología",
      "desc": "社交媒体、人工智能、数字生活"
    },
    {
      "id": "lectura",
      "label": "La lectura",
      "desc": "书籍、展览、创作与审美"
    },
    {
      "id": "vida_urbana",
      "label": "La vida urbana",
      "desc": "交通、邻里、城市与乡村"
    },
    {
      "id": "aprendizaje_espanol",
      "label": "El aprendizaje del español",
      "desc": "学习动机、难点、方法与资源"
    },
    {
      "id": "aprendizaje_ingles",
      "label": "El aprendizaje del inglés",
      "desc": "学习经历、口语练习、方法交流"
    }
  ],
  "time_allocation": [
    {
      "phase": "apertura",
      "label": "开场",
      "pct": 0.111,
      "minutes": 10
    },
    {
      "phase": "rompehielos",
      "label": "破冰",
      "pct": 0.067,
      "minutes": 6
    },
    {
      "phase": "tema",
      "label": "话题引入",
      "pct": 0.156,
      "minutes": 14
    },
    {